{
  "$schema": "./$schema.json",
  "general": {
    "active": "Активен",
    "inactive": "Неактивен",
    "error": "Ошибка",
    "success": "Успешно",
    "of": "из",
    "results": "результатов",
    "pages": "страниц",
    "next": "Далее",
    "prev": "Назад"
  },
  "actions": {
    "create": "Создать",
    "edit": "Редактировать",
    "delete": "Удалить",
    "deleteFile": "Удалить файл",
    "save": "Сохранить",
    "cancel": "Отмена",
    "launchNow": "Запустить сейчас"
  },
  "dateTime": {
    "days": "д",
    "hours": "ч",
    "minutes": "мин"
  },
  "feeds": {
    "domain": "Фиды",
    "subtitle": "Создавайте фиды для выгрузки данных по расписанию",
    "create": {
      "title": "Создать фид",
      "description": "Создавайте и управляйте настройками фида."
    },
    "fields": {
      "title": "Название",
      "fileName": "Имя файла",
      "filePath": "Путь к файлу",
      "lastExport": "Последний экспорт",
      "status": "Статус",
      "schedule": "Интервал экспорта",
      "id": "ID",
      "feedFormat": "Формат фида",
      "feedUrl": "Ссылка на фид",
      "created": "Создано",
      "updated": "Обновлено"
    },
    "edit": {
      "title": "Редактировать фид",
      "description": "Обновить конфигурацию фида."
    },
    "toasts": {
      "exportLaunched": "Фид успешно запущен",
      "categoriesSaved": "Категории успешно сохранены",
      "categoriesSaveFailed": "Не получучилось сохранить категории"
    },
    "prompts": {
      "deleteFeed": {
        "title": "Вы уверены?",
        "description": "Вы собираетесь удалить фид. Это действие нельзя отменить."
      },
      "deleteFeedFile": {
        "title": "Вы уверены?",
        "description": "Вы собираетесь удалить файл фида. Это действие нельзя отменить."
      }
    },
    "tooltips": {
      "schedule": "Установите интервал для экспорта фида"
    },
    "activityContainer": {
      "title": "Активность",
      "subtitle": "Если флаг снят, фид не будет экспортироваться по расписанию."
    }
  },
  "settings": {
    "shop": {
      "title": "Магазин",
      "subtitle": "Данные магазина для файла фида",
      "fields": {
        "name": "Название магазина",
        "company": "Компания",
        "url": "URL магазина",
        "platform": "Платформа"
      },
      "edit": {
        "title": "Редактировать магазин",
        "description": "Обновить данные магазина"
      }
    },
    "categories": {
      "title": "Категории товаров",
      "subtitle": "Выберите категории товаров для экспорта"
    }
  }
}